--
-- Test DELETE
--
DROP TABLE IF EXISTS tbl1;
CREATE TABLE tbl1 (c1 int, c2 int, c3 int);
INSERT INTO tbl1 VALUES
    (0, 1, 2),
    (3, 4, 5),
    (6, 7, 8),
    (9, 10, 11),
    (12, 13, 14),
    (15, 16, 17),
    (18, 19, 20),
    (21, 22, 23),
    (24, 25, 26),
    (27, 28, 29),
    (30, 31, 32);
SELECT * FROM tbl1;
    c1 c2 c3
    -- -- --
  1  0  1  2
  2 12 13 14
  3 15 16 17
  4 18 19 20
  5 21 22 23
  6 24 25 26
  7 27 28 29
  8  3  4  5
  9 30 31 32
 10  6  7  8
 11  9 10 11
(11 rows)
DELETE FROM tbl1 WHERE c1 < 6;
SELECT * FROM tbl1;
   c1 c2 c3
   -- -- --
 1 12 13 14
 2 15 16 17
 3 18 19 20
 4 21 22 23
 5 24 25 26
 6 27 28 29
 7 30 31 32
 8  6  7  8
 9  9 10 11
(9 rows)
DELETE FROM tbl1 WHERE c2 = 16;
SELECT * FROM tbl1;
   c1 c2 c3
   -- -- --
 1 12 13 14
 2 18 19 20
 3 21 22 23
 4 24 25 26
 5 27 28 29
 6 30 31 32
 7  6  7  8
 8  9 10 11
(8 rows)
DELETE FROM tbl1;
SELECT * FROM tbl1;
  c1 c2 c3
  -- -- --
(no rows)
