--
-- Test FOREIGN KEY constraints
--
-- {{if eq Dialect "sqlite3"}}{{Skip}}{{end}}
DROP TABLE IF EXISTS tbl3;
DROP TABLE IF EXISTS tbl2;
DROP TABLE IF EXISTS tbl1;
CREATE TABLE tbl1 (
    c1 int PRIMARY KEY,
    c2 int,
    c3 int
);
CREATE TABLE tbl2 (
    c4 int PRIMARY KEY,
    c5 int,
    c6 int REFERENCES tbl1 ON DELETE CASCADE
    -- c6 int REFERENCES tbl1 ON DELETE CASCADE ON UPDATE CASCADE
);
INSERT INTO tbl1 VALUES
    (1, 10, 100),
    (2, 20, 200),
    (3, 30, 300),
    (4, 40, 400),
    (5, 50, 500),
    (6, 60, 600),
    (7, 70, 700),
    (8, 80, 800);
INSERT INTO tbl2 VALUES
    (10, 100, 1),
    (20, 200, 2),
    (30, 300, 3),
    (40, 400, 1),
    (50, 500, 2),
    (60, 600, 3);
SELECT * FROM tbl1;
   c1 c2  c3
   -- --  --
 1  1 10 100
 2  2 20 200
 3  3 30 300
 4  4 40 400
 5  5 50 500
 6  6 60 600
 7  7 70 700
 8  8 80 800
(8 rows)
SELECT * FROM tbl2;
   c4  c5 c6
   --  -- --
 1 10 100  1
 2 20 200  2
 3 30 300  3
 4 40 400  1
 5 50 500  2
 6 60 600  3
(6 rows)
DELETE FROM tbl1 WHERE c1 = 7;
DELETE FROM tbl1 WHERE c1 = 2;
SELECT * FROM tbl1;
   c1 c2  c3
   -- --  --
 1  1 10 100
 2  3 30 300
 3  4 40 400
 4  5 50 500
 5  6 60 600
 6  8 80 800
(6 rows)
SELECT * FROM tbl2;
   c4  c5 c6
   --  -- --
 1 10 100  1
 2 30 300  3
 3 40 400  1
 4 60 600  3
(4 rows)
-- Drop table with foreign key reference first.
DROP TABLE IF EXISTS tbl2;
DROP TABLE IF EXISTS tbl1;
CREATE TABLE tbl1 (
    c1 int PRIMARY KEY,
    c2 int
);
CREATE TABLE tbl2 (
    c3 int PRIMARY KEY,
    c4 int REFERENCES tbl1 ON DELETE CASCADE
);
DROP TABLE IF EXISTS tbl3;
CREATE TABLE tbl3 (
    c5 int PRIMARY KEY,
    c6 int REFERENCES tbl2 ON DELETE RESTRICT
);
INSERT INTO tbl1 VALUES
    (1, 10),
    (2, 20),
    (3, 30),
    (4, 40),
    (5, 50),
    (6, 60);
INSERT INTO tbl2 VALUES
    (10, 1),
    (11, 1),
    (12, 1),
    (20, 2),
    (30, 3),
    (31, 3);
INSERT INTO tbl3 VALUES
    (100, 11),
    (101, 11),
    (200, 20),
    (201, 20),
    (202, 20),
    (300, 31);
SELECT * FROM tbl1;
   c1 c2
   -- --
 1  1 10
 2  2 20
 3  3 30
 4  4 40
 5  5 50
 6  6 60
(6 rows)
SELECT * FROM tbl2;
   c3 c4
   -- --
 1 10  1
 2 11  1
 3 12  1
 4 20  2
 5 30  3
 6 31  3
(6 rows)
SELECT * FROM tbl3;
    c5 c6
    -- --
 1 100 11
 2 101 11
 3 200 20
 4 201 20
 5 202 20
 6 300 31
(6 rows)
DELETE FROM tbl1 WHERE c1 = 10;
DELETE FROM tbl2 WHERE c3 = 30;
{{Fail .Test}}
DELETE FROM tbl2 WHERE c3 = 20;
{{Fail .Test}}
DELETE FROM tbl1 WHERE c1 = 2;
SELECT * FROM tbl1;
   c1 c2
   -- --
 1  1 10
 2  2 20
 3  3 30
 4  4 40
 5  5 50
 6  6 60
(6 rows)
SELECT * FROM tbl2;
   c3 c4
   -- --
 1 10  1
 2 11  1
 3 12  1
 4 20  2
 5 31  3
(5 rows)
SELECT * FROM tbl3;
    c5 c6
    -- --
 1 100 11
 2 101 11
 3 200 20
 4 201 20
 5 202 20
 6 300 31
(6 rows)
-- Drop table with foreign key references first.
DROP TABLE IF EXISTS tbl3;
DROP TABLE IF EXISTS tbl2;
DROP TABLE IF EXISTS tbl1;
