--
-- Test UNIQUE constraints
--
-- {{if eq Dialect "sqlite3"}}{{Skip}}{{end}}
DROP TABLE IF EXISTS tbl1;
CREATE TABLE tbl1 (
    c1 int primary key,
    c2 int unique,
    c3 int
);
INSERT INTO tbl1 VALUES
    (0, 10, 0),
    (1, 20, 0),
    (2, 30, 0),
    (3, 40, 0);
SELECT * FROM tbl1;
   c1 c2 c3
   -- -- --
 1  0 10  0
 2  1 20  0
 3  2 30  0
 4  3 40  0
(4 rows)
{{Fail .Test}}
INSERT INTO tbl1 VALUES
    (4, 10, 0);
SELECT * FROM tbl1;
   c1 c2 c3
   -- -- --
 1  0 10  0
 2  1 20  0
 3  2 30  0
 4  3 40  0
(4 rows)
INSERT INTO tbl1 VALUES
    (4, 50, 0),
    (5, 60, 0),
    (6, 70, 0);
{{Fail .Test}}
INSERT INTO tbl1 VALUES
    (7, 80, 0),
    (8, 90, 0),
    (9, 10, 0),
    (10, 110, 0);
SELECT * FROM tbl1;
   c1 c2 c3
   -- -- --
 1  0 10  0
 2  1 20  0
 3  2 30  0
 4  3 40  0
 5  4 50  0
 6  5 60  0
 7  6 70  0
(7 rows)
UPDATE tbl1 SET c2 = c2 + 1 WHERE c1 < 4;
SELECT * FROM tbl1;
   c1 c2 c3
   -- -- --
 1  0 11  0
 2  1 21  0
 3  2 31  0
 4  3 41  0
 5  4 50  0
 6  5 60  0
 7  6 70  0
(7 rows)
{{Fail .Test}}
UPDATE tbl1 SET c2 = c2 + 10;
SELECT * FROM tbl1;
   c1 c2 c3
   -- -- --
 1  0 11  0
 2  1 21  0
 3  2 31  0
 4  3 41  0
 5  4 50  0
 6  5 60  0
 7  6 70  0
(7 rows)
UPDATE tbl1 SET c1 = c1 * 10;
SELECT * FROM tbl1;
   c1 c2 c3
   -- -- --
 1  0 11  0
 2 10 21  0
 3 20 31  0
 4 30 41  0
 5 40 50  0
 6 50 60  0
 7 60 70  0
(7 rows)
UPDATE tbl1 SET c2 = c2 + 1 WHERE c1 < 4;
SELECT * FROM tbl1;
   c1 c2 c3
   -- -- --
 1  0 12  0
 2 10 21  0
 3 20 31  0
 4 30 41  0
 5 40 50  0
 6 50 60  0
 7 60 70  0
(7 rows)
{{Fail .Test}}
UPDATE tbl1 SET c2 = c2 + 10 WHERE c1 = 40;
{{Fail .Test}}
INSERT INTO tbl1 VALUES
    (40, 51, 0);
{{Fail .Test}}
INSERT INTO tbl1 VALUES
    (41, 50, 0);
UPDATE tbl1 SET c3 = 1;
SELECT * FROM tbl1;
   c1 c2 c3
   -- -- --
 1  0 12  1
 2 10 21  1
 3 20 31  1
 4 30 41  1
 5 40 50  1
 6 50 60  1
 7 60 70  1
(7 rows)
DELETE FROM tbl1 WHERE c1 = 40;
SELECT * FROM tbl1;
   c1 c2 c3
   -- -- --
 1  0 12  1
 2 10 21  1
 3 20 31  1
 4 30 41  1
 5 50 60  1
 6 60 70  1
(6 rows)
UPDATE tbl1 SET c2 = 50 WHERE c1 = 50;
SELECT * FROM tbl1;
   c1 c2 c3
   -- -- --
 1  0 12  1
 2 10 21  1
 3 20 31  1
 4 30 41  1
 5 50 50  1
 6 60 70  1
(6 rows)
DELETE FROM tbl1 WHERE c1 >= 50;
SELECT * FROM tbl1;
   c1 c2 c3
   -- -- --
 1  0 12  1
 2 10 21  1
 3 20 31  1
 4 30 41  1
(4 rows)
{{Fail .Test}}
INSERT INTO tbl1 VALUES
    (NULL, 80, 0);
{{Fail .Test}}
UPDATE tbl1 SET c1 = NULL WHERE c1 = 20;
INSERT INTO tbl1 VALUES
    (40, 50, 0),
    (50, 60, 0),
    (60, 70, 0);
SELECT * FROM tbl1;
   c1 c2 c3
   -- -- --
 1  0 12  1
 2 10 21  1
 3 20 31  1
 4 30 41  1
 5 40 50  0
 6 50 60  0
 7 60 70  0
(7 rows)
